{
  "repository": "ProfRandom92/Comptext",
  "pr_number": 17,
  "pr_url": "https://github.com/ProfRandom92/Comptext/pull/17",
  "branch": "plugin/pr-review-memory-renderer-v0",
  "head_sha": "dryrun1234567890abcdef1234567890abcdef1234",
  "status": "review_in_progress",
  "actionable_items": [
    {
      "thread_id": "gemini-thread-1",
      "file": "plugins/pr-review-memory/SKILL.md",
      "summary": "Clarify that unresolved review work must not be marked resolved."
    }
  ],
  "completed_fixes": [
    {
      "thread_id": "review-thread-2",
      "files": [
        "docs/PLUGIN_SYSTEM.md"
      ],
      "summary": "Added plugin system link and dry-run boundary language."
    }
  ],
  "resolved_items": [
    {
      "thread_id": "review-thread-2",
      "summary": "Documentation boundary language updated and rechecked."
    }
  ],
  "unresolved_items": [
    {
      "thread_id": "gemini-thread-1",
      "reason": "Actionable comment not fixed yet."
    }
  ],
  "validation_summary": {
    "python -m pytest": "passed",
    "git diff --check": "passed"
  },
  "merge_readiness": {
    "status": "blocked",
    "reason": "Unresolved actionable review thread remains."
  },
  "next_action": "Fix gemini-thread-1, rerun validation, then recheck merge readiness."
}
